{
  "annual_report_source_ids": [],
  "body_id": "uk-state-body-lake-district-national-park-authority",
  "body_type": "other_body",
  "classification_source_ids": [
    "source-official-dataset-govuk-organisations-api"
  ],
  "external_ids": {
    "charity_number": null,
    "company_number": null,
    "govuk_analytics_identifier": "OT220",
    "govuk_content_id": "521ef7a8-cd3c-410a-913e-97b27c686f61"
  },
  "founding_source_ids": [],
  "framework_document_source_ids": [],
  "govuk_organisation_slug": "lake-district-national-park-authority",
  "jurisdiction": [
    "UK"
  ],
  "last_reviewed": null,
  "name": "Lake District National Park Authority",
  "needs_classification_review": true,
  "notes": null,
  "other_names": [],
  "parent_body_id": null,
  "record_status": "extracted",
  "sponsor_department_id": "uk-state-body-department-for-environment-food-rural-affairs",
  "status": "active"
}
