{
  "annual_report_source_ids": [],
  "body_id": "uk-state-body-crown-prosecution-service",
  "body_type": "non_ministerial_department",
  "classification_source_ids": [
    "source-official-dataset-govuk-organisations-api"
  ],
  "external_ids": {
    "charity_number": null,
    "company_number": null,
    "govuk_analytics_identifier": "D101",
    "govuk_content_id": "6c97de66-80ac-4eca-9a19-92d16442e72f"
  },
  "founding_source_ids": [],
  "framework_document_source_ids": [],
  "govuk_organisation_slug": "crown-prosecution-service",
  "jurisdiction": [
    "UK"
  ],
  "last_reviewed": null,
  "name": "Crown Prosecution Service",
  "needs_classification_review": false,
  "notes": null,
  "other_names": [],
  "parent_body_id": null,
  "record_status": "extracted",
  "sponsor_department_id": null,
  "status": "active"
}
