{
  "annual_report_source_ids": [],
  "body_id": "uk-state-body-government-chemist",
  "body_type": "division_directorate",
  "classification_source_ids": [
    "source-official-dataset-govuk-organisations-api"
  ],
  "external_ids": {
    "charity_number": null,
    "company_number": null,
    "govuk_analytics_identifier": "OT1061",
    "govuk_content_id": "9748e764-3ea4-4f58-bf1c-656970401a22"
  },
  "founding_source_ids": [],
  "framework_document_source_ids": [],
  "govuk_organisation_slug": "government-chemist",
  "jurisdiction": [
    "UK"
  ],
  "last_reviewed": null,
  "name": "Government Chemist",
  "needs_classification_review": true,
  "notes": null,
  "other_names": [],
  "parent_body_id": null,
  "record_status": "extracted",
  "sponsor_department_id": "uk-state-body-department-for-science-innovation-and-technology",
  "status": "active"
}
