{
  "annual_report_source_ids": [],
  "body_id": "uk-state-body-independent-adviser-on-ministers-interests",
  "body_type": "other_body",
  "classification_source_ids": [
    "source-official-dataset-govuk-organisations-api"
  ],
  "external_ids": {
    "charity_number": null,
    "company_number": null,
    "govuk_analytics_identifier": "OT1358",
    "govuk_content_id": "8e677682-1c88-446c-9c6b-440ce0ea57c6"
  },
  "founding_source_ids": [],
  "framework_document_source_ids": [],
  "govuk_organisation_slug": "independent-adviser-on-ministers-interests",
  "jurisdiction": [
    "UK"
  ],
  "last_reviewed": null,
  "name": "Independent Adviser on Ministerial Standards",
  "needs_classification_review": true,
  "notes": null,
  "other_names": [],
  "parent_body_id": null,
  "record_status": "extracted",
  "sponsor_department_id": "uk-state-body-cabinet-office",
  "status": "active"
}
