{
  "annual_report_source_ids": [],
  "body_id": "uk-state-body-academy-for-social-justice",
  "body_type": "other_body",
  "classification_source_ids": [
    "source-official-dataset-govuk-organisations-api"
  ],
  "external_ids": {
    "charity_number": null,
    "company_number": null,
    "govuk_analytics_identifier": "OT1276",
    "govuk_content_id": "b854f170-53c8-4098-bf77-e8ef42f93107"
  },
  "founding_source_ids": [],
  "framework_document_source_ids": [],
  "govuk_organisation_slug": "academy-for-social-justice",
  "jurisdiction": [
    "UK"
  ],
  "last_reviewed": null,
  "name": "Academy for Social Justice",
  "needs_classification_review": true,
  "notes": null,
  "other_names": [],
  "parent_body_id": null,
  "record_status": "extracted",
  "sponsor_department_id": "uk-state-body-ministry-of-justice",
  "status": "active"
}
