{
  "annual_report_source_ids": [],
  "body_id": "uk-state-body-security-vetting-appeals-panel",
  "body_type": "advisory_ndpb",
  "classification_source_ids": [
    "source-official-dataset-govuk-organisations-api",
    "source-official-dataset-cabinet-office-public-bodies"
  ],
  "external_ids": {
    "charity_number": null,
    "company_number": null,
    "govuk_analytics_identifier": "PB367",
    "govuk_content_id": "feb0ab2b-dc16-4fc7-abff-8668618d6987"
  },
  "founding_source_ids": [],
  "framework_document_source_ids": [],
  "govuk_organisation_slug": "security-vetting-appeals-panel",
  "jurisdiction": [
    "UK"
  ],
  "last_reviewed": null,
  "name": "Security Vetting Appeals Panel",
  "needs_classification_review": false,
  "notes": null,
  "other_names": [],
  "parent_body_id": null,
  "record_status": "extracted",
  "sponsor_department_id": "uk-state-body-cabinet-office",
  "status": "active"
}
