{
  "annual_report_source_ids": [],
  "body_id": "uk-state-body-civil-service-medical-profession",
  "body_type": "division_directorate",
  "classification_source_ids": [
    "source-official-dataset-govuk-organisations-api"
  ],
  "external_ids": {
    "charity_number": null,
    "company_number": null,
    "govuk_analytics_identifier": "OT1054",
    "govuk_content_id": "660c6a4d-6d84-43b4-9f4a-72bcc9710b33"
  },
  "founding_source_ids": [],
  "framework_document_source_ids": [],
  "govuk_organisation_slug": "civil-service-medical-profession",
  "jurisdiction": [
    "UK"
  ],
  "last_reviewed": null,
  "name": "Medical Profession",
  "needs_classification_review": true,
  "notes": null,
  "other_names": [],
  "parent_body_id": null,
  "record_status": "extracted",
  "sponsor_department_id": null,
  "status": "active"
}
