{
  "annual_report_source_ids": [],
  "body_id": "uk-state-body-family-division-of-the-high-court",
  "body_type": "other_body",
  "classification_source_ids": [
    "source-official-dataset-govuk-organisations-api"
  ],
  "external_ids": {
    "charity_number": null,
    "company_number": null,
    "govuk_analytics_identifier": "CO1155",
    "govuk_content_id": "e549f426-3c3e-4830-9271-313013823931"
  },
  "founding_source_ids": [],
  "framework_document_source_ids": [],
  "govuk_organisation_slug": "family-division-of-the-high-court",
  "jurisdiction": [
    "UK"
  ],
  "last_reviewed": null,
  "name": "Family Division of the High Court",
  "needs_classification_review": true,
  "notes": null,
  "other_names": [],
  "parent_body_id": "uk-state-body-hm-courts-and-tribunals-service",
  "record_status": "extracted",
  "sponsor_department_id": null,
  "status": "active"
}
