{
  "annual_report_source_ids": [],
  "body_id": "uk-state-body-regional-department-for-education-dfe-directors",
  "body_type": "division_directorate",
  "classification_source_ids": [
    "source-official-dataset-govuk-organisations-api"
  ],
  "external_ids": {
    "charity_number": null,
    "company_number": null,
    "govuk_analytics_identifier": "OT1367",
    "govuk_content_id": "d1e421ee-1cfc-44b4-9948-305266d1838d"
  },
  "founding_source_ids": [],
  "framework_document_source_ids": [],
  "govuk_organisation_slug": "regional-department-for-education-dfe-directors",
  "jurisdiction": [
    "UK"
  ],
  "last_reviewed": null,
  "name": "Regional Department for Education (DfE) Directors ",
  "needs_classification_review": true,
  "notes": null,
  "other_names": [],
  "parent_body_id": null,
  "record_status": "extracted",
  "sponsor_department_id": null,
  "status": "active"
}
