{
  "annual_report_source_ids": [],
  "body_id": "uk-state-body-royal-academy-of-engineering",
  "body_type": "royal_charter_body",
  "classification_source_ids": [
    "source-official-dataset-privy-council-charters"
  ],
  "external_ids": {
    "charity_number": null,
    "company_number": null,
    "govuk_analytics_identifier": null,
    "govuk_content_id": null
  },
  "founding_source_ids": [],
  "framework_document_source_ids": [],
  "govuk_organisation_slug": null,
  "jurisdiction": [
    "UK"
  ],
  "last_reviewed": null,
  "name": "Royal Academy of Engineering",
  "notes": "Incorporated by Royal Charter (1983); off-register (not on the GOV.UK Organisations API). Existence/classification sourced to the Privy Council record of charters granted; charter provision is a Spiral 2 citation.",
  "other_names": [
    "RAEng",
    "Fellowship of Engineering"
  ],
  "parent_body_id": null,
  "record_status": "extracted",
  "sponsor_department_id": null,
  "status": "active"
}
