{
  "annual_report_source_ids": [],
  "body_id": "uk-state-body-nhs-counter-fraud-authority",
  "body_type": "other_body",
  "classification_source_ids": [
    "source-official-dataset-govuk-organisations-api"
  ],
  "external_ids": {
    "charity_number": null,
    "company_number": null,
    "govuk_analytics_identifier": "OT1243",
    "govuk_content_id": "72c51156-6779-4d53-bb29-2e878453516f"
  },
  "founding_source_ids": [],
  "framework_document_source_ids": [],
  "govuk_organisation_slug": "nhs-counter-fraud-authority",
  "jurisdiction": [
    "UK"
  ],
  "last_reviewed": null,
  "name": "NHS Counter Fraud Authority",
  "needs_classification_review": true,
  "notes": null,
  "other_names": [],
  "parent_body_id": null,
  "record_status": "extracted",
  "sponsor_department_id": "uk-state-body-department-of-health-and-social-care",
  "status": "active"
}
