{
  "annual_report_source_ids": [],
  "body_id": "uk-state-body-gambling-commission",
  "body_type": "executive_ndpb",
  "classification_source_ids": [
    "source-official-dataset-govuk-organisations-api",
    "source-official-dataset-cabinet-office-public-bodies"
  ],
  "external_ids": {
    "charity_number": null,
    "company_number": null,
    "govuk_analytics_identifier": "PB169",
    "govuk_content_id": "4a76efdd-cf13-4eee-ad61-e13c3e6bf45e"
  },
  "founding_source_ids": [],
  "framework_document_source_ids": [],
  "function_source_ids": [
    "source-official-dataset-list-of-uk-regulators"
  ],
  "functions": [
    "regulation"
  ],
  "govuk_organisation_slug": "gambling-commission",
  "jurisdiction": [
    "UK"
  ],
  "last_reviewed": null,
  "name": "Gambling Commission",
  "needs_classification_review": false,
  "notes": null,
  "other_names": [],
  "parent_body_id": null,
  "record_status": "extracted",
  "sponsor_department_id": "uk-state-body-department-for-culture-media-and-sport",
  "status": "active"
}
