{
  "annual_report_source_ids": [],
  "body_id": "uk-state-body-independent-monitoring-authority-for-the-citizens-rights-agreements",
  "body_type": "executive_ndpb",
  "classification_source_ids": [
    "source-official-dataset-govuk-organisations-api",
    "source-official-dataset-cabinet-office-public-bodies"
  ],
  "external_ids": {
    "charity_number": null,
    "company_number": null,
    "govuk_analytics_identifier": "PB1318",
    "govuk_content_id": "bae12d37-f7e3-4d96-85ac-7f6f10c65174"
  },
  "founding_source_ids": [],
  "framework_document_source_ids": [],
  "govuk_organisation_slug": "independent-monitoring-authority-for-the-citizens-rights-agreements",
  "jurisdiction": [
    "UK"
  ],
  "last_reviewed": null,
  "name": "Independent Monitoring Authority for the Citizens’ Rights Agreements",
  "needs_classification_review": false,
  "notes": null,
  "other_names": [],
  "parent_body_id": null,
  "record_status": "extracted",
  "sponsor_department_id": "uk-state-body-ministry-of-justice",
  "status": "active"
}
