{
  "annual_report_source_ids": [],
  "body_id": "uk-state-body-uk-resilience-academy",
  "body_type": "division_directorate",
  "classification_source_ids": [
    "source-official-dataset-govuk-organisations-api"
  ],
  "external_ids": {
    "charity_number": null,
    "company_number": null,
    "govuk_analytics_identifier": "CS1431",
    "govuk_content_id": "898f7022-719b-4919-acd0-5311a467e744"
  },
  "founding_source_ids": [],
  "framework_document_source_ids": [],
  "govuk_organisation_slug": "uk-resilience-academy",
  "jurisdiction": [
    "UK"
  ],
  "last_reviewed": null,
  "name": "UK Resilience Academy",
  "needs_classification_review": true,
  "notes": null,
  "other_names": [],
  "parent_body_id": null,
  "record_status": "extracted",
  "sponsor_department_id": null,
  "status": "active"
}
