{
  "annual_report_source_ids": [],
  "body_id": "uk-state-body-northern-ireland-council-for-the-curriculum-examinations-and-assessment",
  "body_type": "executive_ndpb",
  "classification_source_ids": [
    "source-official-dataset-govuk-organisations-api"
  ],
  "external_ids": {
    "charity_number": null,
    "company_number": null,
    "govuk_analytics_identifier": "OT644",
    "govuk_content_id": "cd9291d8-a04e-4afb-b680-528b8f917f47"
  },
  "founding_source_ids": [],
  "framework_document_source_ids": [],
  "govuk_organisation_slug": "northern-ireland-council-for-the-curriculum-examinations-and-assessment",
  "jurisdiction": [
    "UK"
  ],
  "last_reviewed": null,
  "name": "Northern Ireland Council for the Curriculum, Examinations and Assessment",
  "needs_classification_review": false,
  "notes": null,
  "other_names": [],
  "parent_body_id": "uk-state-body-department-of-education",
  "record_status": "extracted",
  "sponsor_department_id": null,
  "status": "active"
}
