{
  "annual_report_source_ids": [],
  "body_id": "uk-state-body-national-portrait-gallery",
  "body_type": "executive_ndpb",
  "classification_source_ids": [
    "source-official-dataset-govuk-organisations-api",
    "source-official-dataset-cabinet-office-public-bodies"
  ],
  "external_ids": {
    "charity_number": null,
    "company_number": null,
    "govuk_analytics_identifier": "PB179",
    "govuk_content_id": "e81e15cf-90b2-43f3-b3f5-c48735531c23"
  },
  "founding_source_ids": [],
  "framework_document_source_ids": [],
  "govuk_organisation_slug": "national-portrait-gallery",
  "jurisdiction": [
    "UK"
  ],
  "last_reviewed": null,
  "name": "National Portrait Gallery",
  "needs_classification_review": false,
  "notes": null,
  "other_names": [],
  "parent_body_id": null,
  "record_status": "extracted",
  "sponsor_department_id": "uk-state-body-department-for-culture-media-and-sport",
  "status": "active"
}
