{
  "annual_report_source_ids": [],
  "body_id": "uk-state-body-civil-service-government-economic-service",
  "body_type": "division_directorate",
  "classification_source_ids": [
    "source-official-dataset-govuk-organisations-api"
  ],
  "external_ids": {
    "charity_number": null,
    "company_number": null,
    "govuk_analytics_identifier": "OT1037",
    "govuk_content_id": "4e34a225-1264-4af4-961a-22784b510232"
  },
  "founding_source_ids": [],
  "framework_document_source_ids": [],
  "govuk_organisation_slug": "civil-service-government-economic-service",
  "jurisdiction": [
    "UK"
  ],
  "last_reviewed": null,
  "name": "Government Economic Service",
  "needs_classification_review": true,
  "notes": null,
  "other_names": [],
  "parent_body_id": null,
  "record_status": "extracted",
  "sponsor_department_id": null,
  "status": "active"
}
