{
  "annual_report_source_ids": [],
  "body_id": "uk-state-body-nuclear-decommissioning-authority",
  "body_type": "executive_ndpb",
  "classification_source_ids": [
    "source-official-dataset-govuk-organisations-api"
  ],
  "external_ids": {
    "charity_number": null,
    "company_number": null,
    "govuk_analytics_identifier": "PB197",
    "govuk_content_id": "bd692b3d-2d4c-43d9-aa85-32c465e1984a"
  },
  "founding_source_ids": [],
  "framework_document_source_ids": [],
  "govuk_organisation_slug": "nuclear-decommissioning-authority",
  "jurisdiction": [
    "UK"
  ],
  "last_reviewed": null,
  "name": "Nuclear Decommissioning Authority",
  "needs_classification_review": false,
  "notes": null,
  "other_names": [],
  "parent_body_id": null,
  "record_status": "extracted",
  "sponsor_department_id": null,
  "status": "active"
}
