{
  "annual_report_source_ids": [],
  "body_id": "uk-state-body-forensic-science-regulator",
  "body_type": "other_body",
  "classification_source_ids": [
    "source-official-dataset-govuk-organisations-api"
  ],
  "external_ids": {
    "charity_number": null,
    "company_number": null,
    "govuk_analytics_identifier": "OT536",
    "govuk_content_id": "403b037a-5975-46d3-bb3b-02405ca964b8"
  },
  "founding_source_ids": [],
  "framework_document_source_ids": [],
  "function_source_ids": [
    "source-official-dataset-list-of-uk-regulators"
  ],
  "functions": [
    "regulation"
  ],
  "govuk_organisation_slug": "forensic-science-regulator",
  "jurisdiction": [
    "UK"
  ],
  "last_reviewed": null,
  "name": "Forensic Science Regulator",
  "needs_classification_review": true,
  "notes": null,
  "other_names": [],
  "parent_body_id": null,
  "record_status": "extracted",
  "sponsor_department_id": "uk-state-body-home-office",
  "status": "active"
}
