{
  "annual_report_source_ids": [],
  "body_id": "uk-state-body-civil-service-government-veterinary-services",
  "body_type": "division_directorate",
  "classification_source_ids": [
    "source-official-dataset-govuk-organisations-api"
  ],
  "external_ids": {
    "charity_number": null,
    "company_number": null,
    "govuk_analytics_identifier": "OT1047",
    "govuk_content_id": "5aa41748-a66e-4886-b47a-08a7d846370e"
  },
  "founding_source_ids": [],
  "framework_document_source_ids": [],
  "govuk_organisation_slug": "civil-service-government-veterinary-services",
  "jurisdiction": [
    "UK"
  ],
  "last_reviewed": null,
  "name": "Government Veterinary Services ",
  "needs_classification_review": true,
  "notes": null,
  "other_names": [],
  "parent_body_id": null,
  "record_status": "extracted",
  "sponsor_department_id": null,
  "status": "active"
}
