{
  "annual_report_source_ids": [],
  "body_id": "uk-state-body-police-discipline-appeals-tribunal",
  "body_type": "tribunal",
  "classification_source_ids": [
    "source-official-dataset-govuk-organisations-api"
  ],
  "external_ids": {
    "charity_number": null,
    "company_number": null,
    "govuk_analytics_identifier": "PB278",
    "govuk_content_id": "1f3efab6-9890-4ccd-9dff-647907b21dba"
  },
  "founding_source_ids": [],
  "framework_document_source_ids": [],
  "govuk_organisation_slug": "police-discipline-appeals-tribunal",
  "jurisdiction": [
    "UK"
  ],
  "last_reviewed": null,
  "name": "Police Discipline Appeals Tribunal",
  "needs_classification_review": false,
  "notes": null,
  "other_names": [],
  "parent_body_id": null,
  "record_status": "extracted",
  "sponsor_department_id": "uk-state-body-home-office",
  "status": "active"
}
