{
  "annual_report_source_ids": [],
  "body_id": "uk-state-body-sports-grounds-safety-authority",
  "body_type": "executive_ndpb",
  "classification_source_ids": [
    "source-official-dataset-govuk-organisations-api"
  ],
  "external_ids": {
    "charity_number": null,
    "company_number": null,
    "govuk_analytics_identifier": "PB184",
    "govuk_content_id": "fdadc7ea-bd78-4a7a-a6eb-a8f657356994"
  },
  "founding_source_ids": [],
  "framework_document_source_ids": [],
  "govuk_organisation_slug": "sports-grounds-safety-authority",
  "jurisdiction": [
    "UK"
  ],
  "last_reviewed": null,
  "name": "Sports Grounds Safety Authority",
  "needs_classification_review": false,
  "notes": null,
  "other_names": [],
  "parent_body_id": null,
  "record_status": "extracted",
  "sponsor_department_id": "uk-state-body-department-for-culture-media-and-sport",
  "status": "active"
}
