{
  "annual_report_source_ids": [],
  "body_id": "uk-state-body-the-office-of-the-leader-of-the-house-of-commons",
  "body_type": "ministerial_department",
  "classification_source_ids": [
    "source-official-dataset-govuk-organisations-api"
  ],
  "external_ids": {
    "charity_number": null,
    "company_number": null,
    "govuk_analytics_identifier": "D21",
    "govuk_content_id": "3cba3de4-da66-470b-ac4a-75a0bd05f7cc"
  },
  "founding_source_ids": [],
  "framework_document_source_ids": [],
  "govuk_organisation_slug": "the-office-of-the-leader-of-the-house-of-commons",
  "jurisdiction": [
    "UK"
  ],
  "last_reviewed": null,
  "name": "Office of the Leader of the House of Commons",
  "needs_classification_review": false,
  "notes": null,
  "other_names": [],
  "parent_body_id": null,
  "record_status": "extracted",
  "sponsor_department_id": "uk-state-body-cabinet-office",
  "status": "active"
}
