{
  "annual_report_source_ids": [],
  "body_id": "uk-state-body-located",
  "body_type": "executive_ndpb",
  "classification_source_ids": [
    "source-official-dataset-govuk-organisations-api"
  ],
  "external_ids": {
    "charity_number": null,
    "company_number": null,
    "govuk_analytics_identifier": "PB1245",
    "govuk_content_id": "690082aa-386d-4074-b1f2-0123be7268ac"
  },
  "founding_source_ids": [],
  "framework_document_source_ids": [],
  "govuk_organisation_slug": "located",
  "jurisdiction": [
    "UK"
  ],
  "last_reviewed": null,
  "name": "LocatED",
  "needs_classification_review": false,
  "notes": null,
  "other_names": [],
  "parent_body_id": null,
  "record_status": "extracted",
  "sponsor_department_id": null,
  "status": "active"
}
